{
  "envelopeVersion": "PBENC1",
  "contentSchema": "https://privacy-bridge.local/schemas/job.schema.json",
  "contentVersion": "1.0.0",
  "keyId": "aaaaaaaa-aaaa-4aaa-8aaa-aaaaaaaaaaaa",
  "recordType": "JOB_STATE",
  "cipher": {
    "algorithm": "AES-256-GCM",
    "iv": "MDEyMzQ1Njc4OTo7",
    "ciphertext": "7lwHqSsr62LFJIFOgOVtdxoQM7xGUXqvnjZxqgxAZmlxOa9yJq00SpKHlM1rOrC2ydw",
    "authTag": "soXt7dQ2CqO2slFBQOJfzw"
  },
  "aad": {
    "storeId": "22222222-2222-4222-8222-222222222222",
    "clientId": "11111111-1111-4111-8111-111111111111",
    "jobId": "PB-20260825-0123456789",
    "recordType": "JOB_STATE",
    "canonical": "PBENC1\u000022222222-2222-4222-8222-222222222222\u000011111111-1111-4111-8111-111111111111\u0000PB-20260825-0123456789\u0000https://privacy-bridge.local/schemas/job.schema.json\u00001.0.0\u0000JOB_STATE"
  },
  "createdAt": "2026-08-25T08:00:00Z"
}
